cluster,unit,kind,parent_type,text,roberts,smithson,gross_wehling,notes
7,commit:16e76c94d43e7acd13709c441783a30effac49a9:commit_message,top,commit,"(PE-3002) Support cli apps

This commit adds support for looking for cli apps that
upstream projects may wish to ship with their packaging.
It works basically the same as shared config files; projects
can put scripts into their jars in , and
if any such scripts are found, they will be installed
in .  ezbake will also create a wrapper
script in  which allows the apps to be called as
subcommands, an",,,,
7,commit:a8bd63284dcb0a0d0f61c3bc7b1f1d1908143052:commit_message,top,commit,"(maint) Use proper file format for random source

On OpenJDK 8 the security.egd and securerandom.sourcefile parameters,
if set, should have a protocol attached their path. When using
 one can see this error with the
previous value:

With this change service start up time (measure with just
)
goes from 27 seconds on redhat 7 to 20 seconds and from 23 seconds on
debian 8 to 18 seconds.

I should not",,,,
7,commit:009df4251250951339bac9ab7cddb0a1823eee8f:commit_message,top,commit,"(EZ-59) Pass mirrors setting to aether

This commit improves the places where ezbake calls into
pomegranate/aether to make sure that we are passing through
the value for the  setting from the project (or
from the user profile), so that aether will look for artifacts
in our nexus repository before going out to clojars or
maven central.  This should improve performance and reduce
network I/O for our",,,,
7,commit:58b39960427db01ad4cbfd77ddc4492f6e3f7cd2:commit_message,top,commit,"(EZ-72) Support split bootstrap in configuration

This commit adds support to ezbake for splitting a project's bootstrap files
between /etc/puppetlabs/{project}/services.d/ and
/opt/puppetlabs/server/apps/{project}/config/services.d/

This serves the ultimate goal of putting user-configurable service entries
in one location, and the services that should not be modified in another.

It accomplishes",,,,
7,commit:5ae891b67cdc5833ef26dc68f8c288821895ef63:commit_message,top,commit,"(re-4845) Upgrade from pre-aio to aio paths fails to stop service

Because of the path changes and the change to the name of the jar file
when upgrading from, for example, puppetdb 2.3.x to 3.0.x, the new
init script that gets installed is not able to stop the old service.

This updates the search constraints for the PID of the process to look for
the name of the $JARFILE, which should allow the i",,,,
7,commit:d72c2314a1bfa901ff5c0dad49fee99f0c9a7455:commit_message,random,commit,"Remove extra debian defaults file.

Seems to be unnecessary. Also removes references to it in the project_data.yaml
mustache.

Signed-off-by: Wayne <wayne.com>",,,,
7,pr:OpenVoxProject/ezbake:27:comment_body:28,random,pull_request,I tested this a bit more and it seems to work fine. Also I added lots of documentation. Let me know if you have any more questions.,,,,
7,pr:OpenVoxProject/ezbake:16:comment_body:6,random,pull_request,"When I looked at this job I wondered if we even need it at all. In fact, I questioned that wit the entire file because we don't have a Jenkins instance. So is it easier to get rid of it altogether?",,,,
7,commit:cf72edca6b1297fde943522fe3fff12b7440903d:commit_message,random,commit,"Rename stage.clj to core.clj

As the main clj now contains both stage and build logic, it no longer
makes sense to name it stage.clj. This commit renames it to core.clj, as
seems to be common in clojure projects.",,,,
7,commit:77525f035b7aa7ae467de51567b936c115a50102:commit_message,random,commit,"(EZ-35) Make use of project build-scripts

This commit adds a method to copy build-scripts from the current project to the
staging dir. Previously, we only copied build-scripts from direct dependencies,
which resulted in the FOSS puppetserver build-scripts to be used instead of the
pe-puppet-server-extensions build-scripts when building from pe-pse instead of
from pe-puppetserver (PE-28810).

It a",,,,
7,pr:OpenVoxProject/ezbake:27:comment_body:11,random,pull_request,I tested this a bit more and it seems to work fine. Also I added lots of documentation. Let me know if you have any more questions.,,,,
7,commit:3152c2d1eb9266216895eb7ad52ca5f9b6f375b1:commit_message,random,commit,"Fix paths for docs and config files

Verified an RPM and a deb that were built with this configuration,
and the files appear to be getting packed properly now.",,,,
7,commit:2f5b9b8e62f6882a208abbef85df63073af5dce6:commit_message,random,commit,"(SERVER-1247) fix bug with services-d bootstrap on systemd

In systemd, it doesn't appear that variable interpolation is supported
inside of the defaults files.  Prior to this commit, when using
the  option for bootstrap configuration, we were generating
a defaults file that relied on interpolation.  This commit changes
the code to avoid the interpolation.",,,,
7,pr:OpenVoxProject/ezbake:28:body,random,pull_request,This seems to produce valid packages for openvox-server. They start fine with JRE21.,,,,
7,commit:c67e70c657d84937f5c523e40abc2cb08567c254:commit_message,random,commit,"(maint) Undo some bad assumptions from packaging hard-coding

For debian repos with no apt_repo_name set, the packaging tasks that
generate the repo look for artifacts under deb/dist, rather than
deb/dist/main as it had originally appeared. This fixes the code to
match the assumptions in packaging.",,,,
8,pr:OpenVoxProject/ezbake:8:comment_body:12,top,pull_request,"I'm currently using their container for SLES 15
https://github.com/OpenVoxProject/vanagon/blob/38e78d96bd14510e236a1f5137ad87e67a110dfe/lib/vanagon/platform/defaults/sles-15-x86_64.rb#L24

They have one for 12, but I ran into issues with the openvox build on it.  I don't recall what they were, but I should probably try again, since it looks like they updated the image since I last tried.

 Lo",,,,
8,pr:OpenVoxProject/ezbake:8:comment_body:8,top,pull_request,"I'm currently using their container for SLES 15
https://github.com/OpenVoxProject/vanagon/blob/38e78d96bd14510e236a1f5137ad87e67a110dfe/lib/vanagon/platform/defaults/sles-15-x86_64.rb#L24

They have one for 12, but I ran into issues with the openvox build on it.  I don't recall what they were, but I should probably try again, since it looks like they updated the image since I last tried.

 Lo",,,,
9,pr:OpenVoxProject/ezbake:2:comment_body:4,top,pull_request,I was never a fan of this path. I think there is a java11/java17 symlink as well that we could use? We don't really know to what usr/bin/java points and I had multiple issues at customers where this was pointing to a too new or too old jre.,,,,
9,pr:OpenVoxProject/ezbake:37:comment_body:4,top,pull_request,"I don't remember what platform(s) this happened on, but I remember hitting an error where the version of  did not have the  flag for skipping the header.  That's why we went with  instead [here](https://github.com/puppetlabs/puppet_operational_dashboards/blob/main/templates/grafana_wait.epp#L5).  Feel free to ignore if this only applies to old versions we won't see anymore.",,,,
9,pr:OpenVoxProject/ezbake:8:comment_body:10,top,pull_request,"Yep, I think that'd be good.  Testing the openvoxdb package too would be nice, but if the changes work for openvox-server, I don't know why they'd screw up openvoxdb.",,,,
9,pr:OpenVoxProject/ezbake:8:comment_body:14,top,pull_request,"Yep, I think that'd be good.  Testing the openvoxdb package too would be nice, but if the changes work for openvox-server, I don't know why they'd screw up openvoxdb.",,,,
9,commit:00f9b3e7576df88418f4aac45c8643da846276f1:commit_message,top,commit,"Delete unused rake tasks

This removes Jenkins related rake tasks that Perforce used. I haven't
tested this and I don't know if there are more tasks we can remove, e.g.
https://github.com/OpenVoxProject/ezbake/blob/main/resources/puppetlabs/lein-ezbake/template/global/tasks/integration.rake

Signed-off-by: Tim Meusel <tim.de>",,,,
9,commit:badbe78b038b6adee1f3cd85c3a7ef9bd029e8d4:commit_message,random,commit,"(PE-5992) fix heap dump filenames

Sadly, I don't know what we can use for systemd.",,,,
9,pr:OpenVoxProject/ezbake:90:body,random,pull_request,"This removes Jenkins related rake tasks that Perforce used. I haven't tested this and I don't know if there are more tasks we can remove, e.g. https://github.com/OpenVoxProject/ezbake/blob/main/resources/puppetlabs/lein-ezbake/template/global/tasks/integration.rake



#### Pull Request (PR) description


#### This Pull Request (PR) fixes the following issues",,,,
9,pr:OpenVoxProject/ezbake:27:comment_body:23,random,pull_request,I had  the same question. I don't know where the best place would be and that would also be a bigger change. My goal was to get the packages in any working condition.,,,,
9,pr:OpenVoxProject/ezbake:11:comment_body:11,random,pull_request,"I don't know, that's what we usually configure for other vox pupuli projects.",,,,
9,pr:OpenVoxProject/ezbake:12:comment_body:2,random,pull_request,I don't know a lot about the packaging. Do I need to configure something to ensure the config files are removed on package upgrades? Or will that happen automatically because the files are missing in the latest package?,,,,
9,pr:OpenVoxProject/ezbake:11:comment_body:6,random,pull_request,I don't know too much about the actions / the development workflow. I just wanted to clean them up.,,,,
9,pr:OpenVoxProject/ezbake:17:body,random,pull_request,"This removes Jenkins related rake tasks that Perforce used. I haven't tested this and I don't know if there are more tasks we can remove, e.g. https://github.com/OpenVoxProject/ezbake/blob/main/resources/puppetlabs/lein-ezbake/template/global/tasks/integration.rake",,,,
9,pr:OpenVoxProject/ezbake:27:comment_body:6,random,pull_request,I had  the same question. I don't know where the best place would be and that would also be a bigger change. My goal was to get the packages in any working condition.,,,,
